,English,Français
0,Table Field,Tableau Champ
1,Table HTML,Tableau HTML
2,Table updated,Tableau mis à jour
3,Tag Category,Tag Catégorie
4,Tag Doc Category,Tag Doc Catégorie
5,Tag Line,Tag ligne
6,Take Backup Now,Prenez la sauvegarde maintenant
7,Target Detail,Détail cible
8,Target Distribution,Distribution cible
9,Target On,cible sur
10,Tariff Number,tarif Nombre
11,Task Completion,Tâche d'achèvement
12,Task Progress,progression de la tâche
13,Task Weight,Groupe Poids
14,Tax Amount After Discount Amount (Company Currency),Montant de la taxe Après Montant de la remise (Société devise)
15,Tax Category can not be 'Valuation' or 'Valuation and Total' as all items are non-stock items,"Catégorie impôt ne peut pas être « évaluation » ou « évaluation et totale », comme tous les articles sont des articles hors stock"
16,"Tax detail table fetched from item master as a string and stored in this field.
Used for Taxes and Charges","Impôt table récupérées par le maître de l'article comme une chaîne et stockée dans ce domaine en détail.
 Utilisé pour les impôts et frais"
17,Tax Rule,Règle d'impôt
18,Tax Rule Conflicts with {0},Règle fiscale Conflits avec {0}
19,Tax Rule for transactions.,Règle d'impôt pour les transactions.
20,Tax template for buying transactions.,Modèle d'impôt pour l'achat d' opérations .
21,Tax template for selling transactions.,Modèle de la taxe pour la vente de transactions .
22,Tax Template is mandatory.,Modèle d'impôt est obligatoire.
23,Tax Type,Type d'impôt
24,Taxes and Charges Added,Taxes et redevances Ajouté
25,Taxes and Charges Added (Company Currency),Les impôts et les frais supplémentaires (Société Monnaie)
26,Taxes and Charges Calculation,Taxes et frais de calcul
27,Taxes and Charges Deducted,Taxes et frais déduits
28,Taxes and Charges Deducted (Company Currency),Impôts et Charges déduites (Société Monnaie)
29,Team Members Heading,Membres de l'équipe Cap
30,Team Updates,Mises à jour de l'équipe
31,Temperorily Disabled,Temperorily handicapés
32,Term End Date,Date de fin du contrat
33,Term Name,Nom du terme
34,Term Start Date,Durée Date de début
35,Terms and Conditions Help,Termes et Conditions Aide
36,Terretory,Terretory
37,Test Runner,Test Runner
38,Test_Folder,Test_Folder
39,Text Content,Text Content
40,text in document type,texte dans le type de document
41,Text to be displayed for Link to Web Page if this form has a web page. Link route will be automatically generated based on `page_name` and `parent_website_route`,Texte à afficher pour lien vers la page Web si cette forme dispose d'une page web. Lien itinéraire sera automatiquement généré sur la base `et` page_name` parent_website_route`
42,th,e
43,th-large,e-grande
44,th-list,e-list
45,Thank you for your business!,Nous vous remercions de votre entreprise!
46,"The account head under Liability or Equity, in which Profit/Loss will be booked","Le compte tête sous la responsabilité ou l'équité, dans lequel Profit / perte sera comptabilisée"
47,The BOM which will be replaced,La nomenclature qui sera remplacé
48,The Condition '{0}' is invalid,La condition '{0}' est invalide
49,The date on which next invoice will be generated. It is generated on submit.,La date à laquelle prochaine facture sera générée. Il est généré sur soumettre.
50,The date on which recurring invoice will be stop,La date à laquelle la facture récurrente sera arrêter
51,"The day of the month on which auto invoice will be generated e.g. 05, 28 etc","Le jour du mois où la facture automatique sera généré par exemple 05, 28 etc"
52,The day(s) on which you are applying for leave are holidays. You need not apply for leave.,Le jour (s) sur lequel vous postulez pour un congé sont des jours fériés. Vous ne devez pas demander l'autorisation.
53,The first user will become the System Manager (you can change this later).,Le premier utilisateur deviendra le System Manager (vous pouvez changer cela plus tard).
54,The following Production Orders were created:,Les ordres de fabrication suivants ont été créés:
55,The gross weight of the package. Usually net weight + packaging material weight. (for print),Le poids brut du colis. Habituellement poids net + poids du matériau d'emballage. (Pour l'impression)
56,The holiday on {0} is not between From Date and To Date,La fête sur {0} est pas entre De date et à ce jour
57,"The intervals for Grade Code {0} overlaps with the grade intervals for other grades. 
                    Please check intervals {0} and {1} and try again",Les intervalles de code grade {0} chevauchements avec les intervalles de qualité pour les autres grades. S'il vous plaît vérifier les intervalles {0} et {1} et essayez à nouveau
58,The name of the institute for which you are setting up this system.,Le nom de l'institut pour lequel vous configurez ce système.
59,The new BOM after replacement,La nouvelle nomenclature après le remplacement
60,The page you are looking for is missing. This could be because it is moved or there is a typo in the link.,La page que vous recherchez est manquante. Cela pourrait être dû au fait qu'il est déplacé ou il y a une faute de frappe dans le lien.
61,The request for quotation can be accessed by clicking on the following link,La demande de devis peut être consulté en cliquant sur le lien suivant
62,The resource you are looking for is not available,La ressource que vous recherchez n'est pas disponible
63,The selected BOMs are not for the same item,Les nomenclatures sélectionnées ne sont pas pour le même article
64,The selected item cannot have Batch,L'élément sélectionné ne peut pas avoir lot
65,The system provides many pre-defined roles. You can add new roles to set finer permissions.,Le système offre de nombreux rôles prédéfinis . Vous pouvez ajouter de nouveaux rôles pour définir des autorisations plus fines .
66,The Term End Date cannot be earlier than the Term Start Date. Please correct the dates and try again.,La date de fin de terme ne peut pas être antérieure à la date de début de durée. S'il vous plaît corriger les dates et essayez à nouveau.
67,The Term End Date cannot be later than the Year End Date of the Academic Year to which the term is linked (Academic Year {}). Please correct the dates and try again.,La date de fin de terme ne peut pas être postérieure à la fin de l'exercice Date de l'année académique à laquelle le terme est lié (année académique {}). S'il vous plaît corriger les dates et essayez à nouveau.
68,The Term Start Date cannot be earlier than the Year Start Date of the Academic Year to which the term is linked (Academic Year {}). Please correct the dates and try again.,La date de début de terme ne peut pas être antérieure à l'année Date de début de l'année académique à laquelle le terme est lié (année académique {}). S'il vous plaît corriger les dates et essayez à nouveau.
69,"The total Issue / Transfer quantity {0} in Material Request {1}  \
							cannot be greater than requested quantity {2} for Item {3}",La quantité Problème / transfert total {0} dans Material Request {1} \ ne peut pas être supérieure à la quantité demandée {2} pour le poste {3}
70,The unique id for tracking all recurring invoices. It is generated on submit.,L'identifiant unique pour le suivi de toutes les factures récurrentes. Il est généré lors de la soumission.
71,The Year End Date cannot be earlier than the Year Start Date. Please correct the dates and try again.,La date de fin d'année ne peut pas être antérieure à la date Année de début. S'il vous plaît corriger les dates et essayez à nouveau.
72,There can be only one Fold in a form,Il ne peut y avoir qu'un seul pli sous une forme
73,There can only be 1 Account per Company in {0} {1},Il ne peut y avoir 1 compte par la société dans {0} {1}
74,"There can only be one Shipping Rule Condition with 0 or blank value for ""To Value""","Il ne peut y avoir une règle de livraison Etat avec 0 ou valeur vide pour "" To Value """
75,There is an error in your Address Template {0},Il y a une erreur dans votre Modèle d'adresse {0}
76,There is not enough leave balance for Leave Type {0},Il n'y a pas assez de solde de congés d'autorisation de type {0}
77,There must be a default incoming Email Account enabled for this to work. Please setup a default incoming Email Account (POP/IMAP) and try again.,Il doit y avoir un compte de messagerie par défaut entrant activé pour que cela fonctionne. S'il vous plaît configurer un entrant du compte de messagerie par défaut (POP / IMAP) et essayez à nouveau.
78,There must be atleast one permission rule.,Il doit y avoir atleast une règle d'autorisation.
79,There was an error. One probable reason could be that you haven't saved the form. Please contact support@erpnext.com if the problem persists.,Il y avait une erreur . Une raison probable pourrait être que vous n'avez pas enregistré le formulaire. S'il vous plaît contacter support@erpnext.com si le problème persiste .
80,There were errors while deleting following schedules:,Il y avait des erreurs lors de la suppression des horaires suivants:
81,There were errors while scheduling course on :,Il y avait des erreurs lors de la planification cours sur:
82,There were errors while sending email. Please try again.,Il y avait des erreurs lors de l'envoi de courriels. S'il vous plaît essayer à nouveau
83,There were errors. Please report this.,Il y avait des erreurs. S'il vous plaît signaler.
84,"There were some errors setting the name, please contact the administrator","Il y avait des erreurs de réglage le nom, s'il vous plaît contactez l'administrateur"
85,"These permissions will apply for all transactions where the permitted record is linked. For example, if Company C is added to User Permissions of user X, user X will only be able to see transactions that has company C as a linked value.",Ces autorisations s'appliquent pour toutes les transactions où le dossier permis est lié .
86,These restrictions will apply for Document Types where 'Apply User Permissions' is checked for the permission rule and a field with this value is present.,Ces restrictions seront appliquées pour les types de documents où «Appliquer les autorisations des utilisateurs» est cochée pour la règle de l'autorisation et un champ avec cette valeur est présente.
87,These values will be automatically updated in transactions and also will be useful to restrict permissions for this user on transactions containing these values.,Ces valeurs seront automatiquement mis à jour dans les transactions et sera également utile pour restreindre les autorisations pour cet utilisateur sur les transactions contenant ces valeurs.
88,"These will also be set as default values for those links, if only one such permission record is defined.","Elles seront également définies comme valeurs par défaut pour ces liens , si un seul tel dossier d'autorisation est définie ."
89,This {0} conflicts with {1} for {2} {3},Ce {0} conflits avec {1} pour {2} {3}
90,This document is currently queued for execution. Please try again,Ce document est actuellement en attente d'exécution. Veuillez réessayer
91,This document is over limit by {0} {1} for item {4}. Are you making another {3} against the same {2}?,Ce document est supérieure à la limite par {0} {1} pour le poste {4}. Faites-vous une autre {3} contre le même {2}?
92,This feature is brand new and still experimental,Cette fonctionnalité est tout neuf et encore expérimental
93,"This field will appear only if the fieldname defined here has value OR the rules are true (examples): 
myfield
eval:doc.myfield=='My Value'
eval:doc.age>18",Ce champ apparaît uniquement si le fieldname défini ici a une valeur OU les règles sont vrais (exemples): myfield eval: doc.myfield == 'My Value' eval: doc.age> 18
94,This goes above the slideshow.,Cela va au-dessus du diaporama.
95,This is a root customer group and cannot be edited.,Il s'agit d'un groupe de clients de la racine et ne peut être modifié .
96,This is a root sales person and cannot be edited.,Il s'agit d'une personne de ventes de racines et ne peut être modifié .
97,This is a top-10 common password.,Ceci est un mot de passe commun top-10.
98,This is a top-100 common password.,Ceci est un mot de passe commun top-100.
99,This is a very common password.,Ceci est un mot de passe très commun.
100,This is based on logs against this Vehicle. See timeline below for details,Ceci est basé sur les journaux contre ce véhicule. Voir calendrier ci-dessous pour plus de détails
101,This is based on stock movement. See {0} for details,Ceci est basé sur les mouvements de stock. Voir {0} pour plus de détails
102,This is based on the attendance of this Employee,Ceci est basé sur la présence de cet employé
103,This is based on the attendance of this Student,Ceci est basé sur la présence de cet étudiant
104,This is based on the Time Sheets created against this project,Ceci est basé sur les feuilles de temps créées contre ce projet
105,This is based on transactions against this Customer. See timeline below for details,Ceci est basé sur les transactions contre ce client. Voir calendrier ci-dessous pour plus de détails
106,This is based on transactions against this Supplier. See timeline below for details,Ceci est basé sur les transactions contre ce fournisseur. Voir calendrier ci-dessous pour plus de détails
107,This is similar to a commonly used password.,Ceci est similaire à un mot de passe couramment utilisé.
108,This Item is a Template and cannot be used in transactions. Item attributes will be copied over into the variants unless 'No Copy' is set,Cet article est un modèle et ne peut être utilisé dans les transactions. Attributs d'élément seront copiés dans les variantes moins 'No Copy »est réglé
109,This Item is a Variant of {0} (Template). Attributes will be copied over from the template unless 'No Copy' is set,Cet article est une variante de {0} (Template). Attributs seront copiés à partir du modèle à moins 'No Copy »est réglé
110,This Kanban Board will be private,Ce conseil Kanban sera privé
111,This link is invalid or expired. Please make sure you have pasted correctly.,Ce lien est invalide ou expiré. S'il vous plaît faire sûr que vous avez collé correctement.
112,This password will take {0} to crack,Ce mot de passe prendra {0} à craquer
113,This role update User Permissions for a user,Ce rôle Permission mise à jour de l'utilisateur pour un utilisateur
114,"This will be appended to the Item Code of the variant. For example, if your abbreviation is ""SM"", and the item code is ""T-SHIRT"", the item code of the variant will be ""T-SHIRT-SM""","Ce sera ajoutée au Code de la variante de l'article. Par exemple, si votre abréviation est «SM», et le code de l'article est ""T-SHIRT"", le code de l'article de la variante sera ""T-SHIRT-SM"""
115,Threshold,Seuil
116,thumbs-up,thumbs-up
117,Time Sheet,Emploi du temps
118,Time Sheet for manufacturing.,Feuille de temps pour la fabrication.
119,Time Sheet List,Time Sheet Liste
120,Time Sheets,Feuilles de temps
121,Time(in mins),Temps (en minutes)
122,Timeline DocType,DocType timeline
123,Timeline field must be a Link or Dynamic Link,champ calendrier doit être un lien ou Dynamic Link
124,Timeline field must be a valid fieldname,champ calendrier doit être un nom de champ valide
125,Timeline field Name,champ Nom Timeline
126,Timeline Name,Nom timeline
127,Timesheet,Emploi du temps
128,Timesheet {0} is already completed or cancelled,Timesheet {0} est déjà terminée ou annulée
129,Timesheet created:,Timesheet créé:
130,Timesheet Detail,Détail Timesheet
131,Timesheet for tasks.,Timesheet pour les tâches.
132,Timesheets,Timesheets
133,"Timesheets help keep track of time, cost and billing for activites done by your team","Timesheets aider à suivre le temps, le coût et la facturation des activités effectuées par votre équipe"
134,Timestamp,Timestamp
135,Tip:  Double click cell to edit,Astuce: Double cellule cliquez pour modifier
136,Title Case,Case Titre
137,Title field must be a valid fieldname,Champ Titre doit être un nom de champ valide
138,"To allow over-billing or over-ordering, update ""Allowance"" in Stock Settings or the Item.","Pour permettre la surfacturation ou sur-commande, mettre à jour ""allocation"" dans Paramètres stock ou l'article."
139,To and CC,Pour et CC
140,To Currency,Pour Devise
141,To Date should be within the Fiscal Year. Assuming To Date = {0},Pour la date doit être dans l'exercice. En supposant à ce jour = {0}
142,"To filter based on Party, select Party Type first","Pour filtrer sur la base du Parti, sélectionnez Parti premier type"
143,to filter values between 5 & 10,pour filtrer des valeurs comprises entre 5 et 10
144,"To format columns, give column labels in the query.","Pour formater colonnes, donner des étiquettes de colonne dans la requête."
145,"To get the best out of ERPNext, we recommend that you take some time and watch these help videos.","Pour tirer le meilleur parti de ERPNext, nous vous recommandons de prendre un peu de temps et de regarder ces vidéos d'aide."
146,"To give acess to a role for only specific records, check the Apply User Permissions. User Permissions are used to limit users with such role to specific records.","Pour donner acess à un rôle pour que les enregistrements spécifiques, vérifiez les permissions d'utilisation se appliquent. les autorisations des utilisateurs sont utilisés pour limiter les utilisateurs avec ce rôle à des enregistrements spécifiques."
147,"To import or update records, you must first download the template for importing.","Pour importer ou mettre à jour des entrées, vous devez d'abord télécharger le modèle d'import."
148,"To include tax in row {0} in Item rate, taxes in rows {1} must also be included","D'inclure la taxe dans la ligne {0} dans le prix de l'article , les impôts dans les lignes {1} doivent également être inclus"
149,To Invoice Date,Pour Date de la facture
150,"To merge, following properties must be same for both items","Pour fusionner , les propriétés suivantes doivent être les mêmes pour les deux articles"
151,"To not apply Pricing Rule in a particular transaction, all applicable Pricing Rules should be disabled.","De ne pas appliquer la règle Prix dans une transaction particulière, toutes les règles de tarification applicables doivent être désactivés."
152,To Package No.,Pour Emballer n °
153,To Range,Se situer
154,"To renew, {0}.","Pour renouveler, {0}."
155,"To run a test add the module name in the route after '{0}'. For example, {1}","Pour exécuter un essai, ajoutez le nom du module dans le parcours après '{0}'. Par exemple, {1}"
156,"To set this Fiscal Year as Default, click on 'Set as Default'","Pour définir cette Année financière que par défaut , cliquez sur "" Définir par défaut """
157,To Value,To Value
158,Token,Jeton
159,Token is missing,Token est manquant
160,"Too many users signed up recently, so the registration is disabled. Please try back in an hour","Trop d'utilisateurs ont signé récemment, alors l'enregistrement est désactivé. S'il vous plaît essayer de revenir dans une heure"
161,Too many writes in one request. Please send smaller requests,Trop écrit en une seule requête . S'il vous plaît envoyer des demandes plus petites
162,Top Bar,Top Bar
163,Top Bar Color,Top Bar Couleur
164,Top Bar Color and Text Color are the same. They should be have good contrast to be readable.,Top Bar couleur et la couleur du texte sont les mêmes. Ils devraient être présentent un bon contraste pour être lisible.
165,Top Bar Item,Point Bar Top
166,Top Bar Items,Articles Top Bar
167,Top Bar Text Color,Top Bar couleur du texte
168,Topic,Sujet
169,Topic Name,Nom de la rubrique
170,Total (Company Currency),Total (Société devise)
171,Total (Credit),Total (crédit)
172,Total {0} ({1}),Total {0} ({1})
173,"Total {0} for all items is zero, may be you should change 'Distribute Charges Based On'","Total des {0} pour tous les articles est nul, peut-être vous devriez changer « Distribuez frais sur la base »"
174,Total Absent,Absent total
175,Total Achieved,Total obtenu
176,Total Additional Costs,Total des coûts supplémentaires
177,Total advance ({0}) against Order {1} cannot be greater than the Grand Total ({2}),Avance totale ({0}) contre l'ordonnance {1} ne peut pas être supérieure à la Grand total ({2})
178,Total Allocated Amount,Montant total alloué
179,Total Allocated Amount (Company Currency),Montant total alloué (Société Monnaie)
180,Total allocated leaves {0} cannot be less than already approved leaves {1} for the period,Nombre de feuilles alloués {0} ne peut pas être inférieure à feuilles déjà approuvés {1} pour la période
181,Total allocated leaves are more than days in the period,Nombre de feuilles alloués sont plus de jours de la période
182,Total allocated percentage for sales team should be 100,Pourcentage total alloué à l'équipe de vente devrait être de 100
183,Total Amount Currency,Montant total devise
184,Total Amount in Words,Montant Total En Toutes Lettres
185,Total Applicable Charges in Purchase Receipt Items table must be same as Total Taxes and Charges,Total des frais applicables en Achat Table des reçus Les articles doivent être le même que Total des taxes et frais
186,Total Billable Amount,Montant total facturable
187,Total Billable Hours,Nombre total d'heures facturables
188,Total Billed Amount,Montant total Facturé
189,Total Billed Hours,Total des heures facturées
190,Total Billing Amount,Montant total de la facturation
191,Total Billing Amount (via Time Logs),Montant total de la facturation (via Time Logs)
192,Total Billing Amount (via Time Sheet),Montant total de la facturation (via la feuille de temps)
193,Total cannot be zero,Total ne peut pas être zéro
194,Total Characters,Nombre de caractères
195,Total Commission,Total de la Commission
196,Total Cost(Company Currency),Coût total (Société Monnaie)
197,Total Costing Amount,Montant total Costing
198,Total Costing Amount (via Time Logs),Montant total Costing (via Time Logs)
199,Total Costing Amount (via Time Sheet),Total Costing Montant (via la feuille de temps)
200,Total Credit,Crédit total
201,Total Debit,Débit total
202,Total Debit must be equal to Total Credit. The difference is {0},Débit total doit être égal au total du crédit .
203,Total Deduction,Déduction totale
204,Total Experience,Total Experience
205,Total hours: {0},Nombre total d'heures: {0}
206,Total Interest Payable,Total des intérêts à payer
207,Total Invoiced Amount,Montant total facturé
208,Total Invoiced Amt,Total facturé Amt
209,Total Leave Days,Total des jours de congé
210,Total Leaves,Les feuilles au total
211,Total Leaves Allocated,Feuilles total alloué
212,Total leaves allocated is mandatory,Nombre de feuilles alloués est obligatoire
213,Total Loan Repayment,Remboursement du prêt total
214,Total Margin,Marge totale
215,Total Message(s),Comptes temporaires ( actif)
216,Total Number of Depreciations,Nombre total de Amortissements
217,Total number of emails to sync in initial sync process,Nombre total d'e-mails à synchroniser dans le processus de synchronisation initiale
218,Total of all task weights should be 1. Please adjust weights of all Project tasks accordingly,Total de tous les poids de la tâche devrait être 1. S'il vous plaît ajuster les poids de toutes les tâches du projet en conséquence
219,Total Operating Cost,Coût d'exploitation total
220,Total Order Considered,Total de la commande Considéré
221,Total Order Value,Ordre Valeur totale
222,Total Outgoing,Sortant total
223,Total Outstanding Amount,Encours total
224,Total Outstanding Amt,Encours total Amt
225,Total Paid Amount,Montant total payé
226,Total Paid Amt,Amt total payé
227,Total Payable Amount,Montant total à payer
228,Total Payable Interest,Intérêts payables total
229,Total Payment,Paiement total
230,Total Present,Présent total
231,Total Projected Qty,Nombre total prévu
232,Total Purchase Cost (via Purchase Invoice),Coût d'achat total (via la facture d'achat)
233,Total Revenue,Revenu total
234,Total Score,Score total
235,Total Score (Out of 5),Score total (sur 5)
236,Total Subscribers,Nombre total d'abonnés
237,Total Target,Cible total
238,Total Tax,Total Tax
239,Total Taxes and Charges,Total Taxes et frais
240,Total Taxes and Charges (Company Currency),Total des taxes et charges (Société Monnaie)
241,Total Unpaid: {0},Total non rémunéré: {0}
242,Total Variance,Variance totale
243,Total weightage assigned should be 100%. It is {0},Weightage totale attribuée devrait être de 100 % . Il est {0}
244,Total Weightage of all Assessment Criteria must be 100%,Total des weightage de tous les critères d'évaluation doit être 100%
245,Total Working Hours,Total des heures de travail
246,Total working hours should not be greater than max working hours {0},Nombre total d'heures de travail ne doit pas être supérieure à la durée du travail max {0}
247,Traceability,Traçabilité
248,Traceback,Retraçage
249,Track Changes,Suivi des modifications
250,Track Seen,piste Vu
251,Track separate Income and Expense for product verticals or divisions.,Suivre les revenus et dépenses de séparée verticales ou divisions produits.
252,Track this Delivery Note against any Project,Suivre ce bon de livraison contre tout projet
253,Track this Sales Order against any Project,Suivre ce décret ventes contre tout projet
254,Trainer Email,entraîneur Email
255,Trainer Name,Nom formateur
256,Training,Entraînement
257,Training Event,formation événement
258,Training Event Employee,La formation des employés de l'événement
259,Training Feedback,Retour d'expérience sur la formation
260,Training Result,formation Résultat
261,Training Result Employee,Formation Résultat des employés
